<?xml version="1.0" encoding="UTF-8"?>
<!--Sample XML file generated by XMLSpy v2012 sp1 (x64) (http://www.altova.com)-->
<config xsi:noNamespaceSchemaLocation="http://birfh.fh-hagenberg.at/config.xsd" xmlns:xsi="http://www.w3.org/2001/XMLSchema-instance">
    <fnafile>../fastaFiles/1.TCA.454Reads.fna</fnafile>
    <qualfile>../fastaFiles/1.TCA.454Reads.qual</qualfile>
    <midlist>mids.fasta</midlist>
    <primerlist>primers.fasta</primerlist>
    <trimming>
        <median>true</median>
    </trimming>
<!--    <smoothing>
        <grouping percentage="97" anchorAsFiller="true" consensusAsAnchor="true"/>
    </smoothing>-->
    <output name="testconfig" mode="singleFile" extension="zip">

    </output>
    <mailto></mailto>
</config>
